{
  "$schema": "https://json-schema.org/draft/2020-12/schema",
  "$id": "https://pumni.example/schemas/task-packet.schema.json",
  "title": "Architect Authored Task Packet",
  "type": "object",
  "additionalProperties": false,
  "required": ["schema_version", "task_id", "objective", "decision_authority", "executor_role", "context_profile", "required_baseline_commit", "allowed_paths", "forbidden_paths", "create_files", "modify_files", "implementation_sequence", "decision_points", "impacts", "acceptance_criteria", "verification", "escalation_conditions", "completion_report_required"],
  "properties": {
    "schema_version": {"const": "1.0.0"},
    "task_id": {"type": "string", "minLength": 1},
    "objective": {"type": "string", "minLength": 1},
    "decision_authority": {"const": "architect"},
    "executor_role": {"const": "implementation_only"},
    "context_profile": {"type": "string", "minLength": 1},
    "required_baseline_commit": {"type": "string", "pattern": "^[0-9a-fA-F]{40}$"},
    "allowed_paths": {"type": "array", "minItems": 1, "items": {"type": "string", "minLength": 1}},
    "forbidden_paths": {"type": "array", "items": {"type": "string", "minLength": 1}},
    "create_files": {"type": "array", "items": {"type": "string", "minLength": 1}},
    "modify_files": {
      "type": "array",
      "items": {
        "type": "object",
        "additionalProperties": false,
        "required": ["path", "changes"],
        "properties": {
          "path": {"type": "string", "minLength": 1},
          "changes": {"type": "array", "minItems": 1, "items": {"type": "string", "minLength": 1}}
        }
      }
    },
    "implementation_sequence": {"type": "array", "minItems": 1, "items": {"type": "string", "minLength": 1}},
    "decision_points": {"type": "array", "maxItems": 0, "items": {}},
    "impacts": {
      "type": "object",
      "additionalProperties": false,
      "required": ["runtime_behavior", "domain_behavior", "api", "database", "dependencies", "behavior_versions"],
      "properties": {
        "runtime_behavior": {"enum": ["none", "specified_change"]},
        "domain_behavior": {"enum": ["none", "specified_change"]},
        "api": {"enum": ["none", "specified_change"]},
        "database": {"enum": ["none", "specified_change"]},
        "dependencies": {"enum": ["none", "specified_change"]},
        "behavior_versions": {"enum": ["none", "specified_change"]}
      }
    },
    "impact_spec": {"type": "object"},
    "acceptance_criteria": {"type": "array", "minItems": 1, "items": {"type": "string", "minLength": 1}},
    "verification": {
      "type": "array",
      "minItems": 1,
      "items": {
        "type": "object",
        "additionalProperties": false,
        "required": ["gate", "command", "required"],
        "properties": {
          "gate": {"type": "string", "minLength": 1},
          "command": {"type": "string", "minLength": 1},
          "required": {"type": "boolean"}
        }
      }
    },
    "escalation_conditions": {"type": "array", "minItems": 1, "items": {"type": "string", "minLength": 1}},
    "completion_report_required": {"const": true}
  }
}
